{
  "schemaVersion": 1,
  "evidenceId": "activation-valid-v1",
  "recordedAt": "2026-08-12T12:00:00.000Z",
  "policyVersion": "skillwire-activation-v1",
  "corpusId": "autonomous-activation-v1",
  "catalogRelease": "activation-catalog-v1",
  "protocolVersion": "2026-07-28",
  "harness": {
    "name": "fixture-harness",
    "version": "1.0.0"
  },
  "model": {
    "name": "fixture-model",
    "version": "1.0.0"
  },
  "environmentProfile": "clean-fixture-v1",
  "localInventoryVersion": "activation-local-v1",
  "evaluatorVersion": "activation-evaluator-v1",
  "traceSource": "observer-proxy",
  "instructionsSha256": "d1e923bf6c80b6c41070cc6ffc1678e6caa738f1427ac2e9dfda6c00ceb1091e",
  "privacyDeclaration": {
    "containsRawPrompts": false,
    "containsTaskSummaries": false,
    "containsRepositoryHashes": false,
    "containsLocalPaths": false,
    "containsSkillContent": false,
    "containsCredentialsOrHeaders": false
  },
  "observations": [
    {
      "caseId": "auto-typescript-code-review-1",
      "instructionsObserved": true,
      "instructionMethod": "server/discover",
      "status": "completed",
      "toolCalls": [
        {
          "sequence": 1,
          "toolName": "search_skills",
          "invocationContext": "automatic",
          "result": "success"
        },
        {
          "sequence": 2,
          "toolName": "load_skill",
          "skill": {
            "skillId": "typescript-code-review",
            "revision": "1.0.0",
            "revisionSha256": "23ae106db34f706318436b69b6bf2380ce828bf6d2f685a629e946f6ad6827ec"
          },
          "result": "success"
        }
      ],
      "guidanceSource": "skillwire",
      "verifiedSkillWireLoad": {
        "skillId": "typescript-code-review",
        "revision": "1.0.0",
        "revisionSha256": "23ae106db34f706318436b69b6bf2380ce828bf6d2f685a629e946f6ad6827ec"
      },
      "completionEvidence": "observed-completion",
      "positiveOutcomeRecorded": false,
      "clientTreeWrites": 0,
      "githubRequests": 0,
      "diagnosticCodes": []
    }
  ],
  "metrics": {
    "spontaneousActivation": {
      "numerator": 1,
      "denominator": 1,
      "rate": 1
    },
    "correctSelectionAfterSearch": {
      "numerator": 1,
      "denominator": 1,
      "rate": 1
    },
    "unnecessaryActivation": {
      "numerator": 0,
      "denominator": 0,
      "rate": 0
    },
    "userRequestedIsolation": {
      "numerator": 0,
      "denominator": 0,
      "rate": 0
    },
    "progressiveLoadingConformance": {
      "numerator": 1,
      "denominator": 1,
      "rate": 1
    },
    "zeroClientWrites": true,
    "zeroAgentFacingGithubRequests": true,
    "localOverlap": {
      "equivalentCases": 0,
      "overlappingCases": 0,
      "violations": 0
    }
  }
}
