{
  "schemaVersion": 1,
  "evidenceId": "activation-incomplete-v1",
  "recordedAt": "2026-08-12T12:00:00.000Z",
  "policyVersion": "skillwire-activation-v1",
  "corpusId": "autonomous-activation-v1",
  "catalogRelease": "activation-catalog-v1",
  "protocolVersion": "2026-07-28",
  "harness": {
    "name": "fixture-harness",
    "version": "1.0.0"
  },
  "model": {
    "name": "fixture-model",
    "version": "1.0.0"
  },
  "environmentProfile": "clean-fixture-v1",
  "localInventoryVersion": "activation-local-v1",
  "evaluatorVersion": "activation-evaluator-v1",
  "traceSource": "observer-proxy",
  "instructionsSha256": "d1e923bf6c80b6c41070cc6ffc1678e6caa738f1427ac2e9dfda6c00ceb1091e",
  "privacyDeclaration": {
    "containsRawPrompts": false,
    "containsTaskSummaries": false,
    "containsRepositoryHashes": false,
    "containsLocalPaths": false,
    "containsSkillContent": false,
    "containsCredentialsOrHeaders": false
  },
  "observations": [
    {
      "caseId": "failure-service-unavailable",
      "instructionsObserved": false,
      "instructionMethod": "not-observed",
      "status": "incomplete",
      "toolCalls": [],
      "guidanceSource": "none",
      "verifiedSkillWireLoad": null,
      "completionEvidence": "none",
      "positiveOutcomeRecorded": false,
      "clientTreeWrites": 0,
      "githubRequests": 0,
      "diagnosticCodes": ["INSTRUCTIONS_NOT_OBSERVED", "INCOMPLETE_TRACE"]
    }
  ],
  "metrics": {
    "spontaneousActivation": {
      "numerator": 0,
      "denominator": 0,
      "rate": 0
    },
    "correctSelectionAfterSearch": {
      "numerator": 0,
      "denominator": 0,
      "rate": 0
    },
    "unnecessaryActivation": {
      "numerator": 0,
      "denominator": 0,
      "rate": 0
    },
    "userRequestedIsolation": {
      "numerator": 0,
      "denominator": 0,
      "rate": 0
    },
    "progressiveLoadingConformance": {
      "numerator": 0,
      "denominator": 0,
      "rate": 0
    },
    "zeroClientWrites": true,
    "zeroAgentFacingGithubRequests": true,
    "localOverlap": {
      "equivalentCases": 0,
      "overlappingCases": 0,
      "violations": 0
    }
  }
}
